,Use remote electronic Patient-reported outcomes (PROs) and wearable step monitoring to solve the deficiency symptom management.,"Identify patients with high symptom burden, poor quality of life or poor functional status to enhance symptom management in advanced cancer.",Yes,"Physician, Patient",,Patient,,Current practices miss or underestimate patient-reported symptom severity,Use remote electronic Patient-reported outcomes (PROs) and wearable step monitoring to accurately track symtoms and activity level for patients undergoing cancer treatment.,"Low motivation or awareness: don't know, understand or appreciate the values of desired behaviour",,PROs are mostly seen at in-clinic visits and rarely integrate with technology that enables remote PRO collection.,Tailored interventions based on real-time data improve symptom management,Stage 3,,Hospital Care,,,,,,,,,,,,,,,,,,,,,,
,"Integrate screening, referral, and treatment for depression to solve limitation of knowledge in implemention of adlescent depression services.",Limited knowledge in effective implementation of adolescent depression services in primary care clinics in Mozambique,Yes,"Physician, Nurse, Nurse Practitioner, Others, Public Health",,Patient,,Existing services are not effectively integrated; limited adolescent mental health care services are accessible to adolescents.,"Integrate screening, referral, and treatment for depression guided by implementation mapping.",Research lagging behind: researchers and/or healthcare practitioners need further understanding,,"Lack of studies, resources; cultural and systemic barriers","Enhances access to care, addresses treatment gap, and improves adolescent mental health outcomes.",Stage 1,,"Primary Care, Community Care",,,,,,,,,,,,,,,,,,,,,,
,Allow patients to monitor oxygen saturation at home to solve the ambiguity of effectiveness in current remote-monitoring programs.,Unknown effectiveness of home pulse oximetry in COVID-19 remote-monitoring programs.,No,"Physician, Nurse, Patient",,Patient,,"Patients were monitored via text messages, with some also using home pulse oximetry.",Patients to monitor oxygen saturation at home.,Tech/tools constraints: the desired behaviour change is restricted due to underequipped or inaccessible technology/device/tools,,"Technological challenges, lack of understanding of the device's importance, or simply forgetting to take daily measurements.","Remote-monitoring programs proves as effective as current practice, implying that the patient caring regarding COVID-19 can be more flexiable in the future.",Stage 2,,"Primary Care, Community Care",,,,,,,,,,,,,,,,,,,,,,
,Incorporate gamification and behavioral economics principles in a digital health intervention to solve the increased cardiovascular risk for female with hypertensive disorders of pregnancy (HDP).,Increased cardiovascular risk for female with hypertensive disorders of pregnancy (HDP).,Yes,"Physician, Nurse, Nurse Practitioner, Public Health",,Patient,,"Using interventions strategy, such as internet-based modules, telephone-based coaching, and social media support group, to promote physicial activity for reducing cardiovascular risk.",Incorporate gamification and behavioral economics principles in a digital health intervention to motivate daily step goal achievement,Tech/tools constraints: the desired behaviour change is restricted due to underequipped or inaccessible technology/device/tools,,Integrate new behaviors into daily routines and potential technological barriers,"Gamification and social incentives encourage physical activity, addressing cardiovascular risk","Stage 1, Stage 2",,"Primary Care, Community Care",,,,,,,,,,,,,,,,,,,,,,
,Deliver targeted training on opioid withdrawal management and buprenorphine initiation to solve ambiguity of practice in emergency department initiation of buprenorphine for opioid use disorder (OUD).,Unclear practice in emergency department initiation of buprenorphine for opioid use disorder (OUD).,Yes,"Physician, Nurse",,Patient,,Emergency medicine clinicians lack training on managing acute opioid withdrawal and initiating buprenorphine treatment,Clinicians should receive targeted training on opioid withdrawal management and buprenorphine initiation,Ambiguity: unclear guidance to users to adopt desired behaviour,,"Lack of training, negative attitudes towards buprenorphine, and misconceptions about regulations","Targeted training improves clinicians' knowledge and attitudes towards buprenorphine, facilitating its use and potentially improving patient outcomes",Stage 2,,"Hospital Care, particularly emergency departments",,,,,,,,,,,,,,,,,,,,,,
,Add an electronic health record (HER) default order to solve the low rate of screening for hepatitis C virus (HCV) among hospitalized patients.,Low rate of Hepatitis C virus (HCV) screening among hospitalized patients,Yes,"Physician, Nurse",,Patient,,HCV screening rates were low due to reliance on clinician-initiated orders,Add an electronic health record (HER) default order to increase screening for hepatitis C virus (HCV) among hospitalized patients,"Low motivation or awareness: don't know, understand or appreciate the values of desired behaviour",,Potential extra clinician efforts and burden.,More HCR screening are scheduled by implementing default choice to change HCV screening from opt-in to opt-out and emedding HCR into clinic routine.,Stage 2,,Hospital Care,,,,,,,,,,,,,,,,,,,,,,
,Adopt a sustained behaviour change from hand-held to hand-free phone use by using phone mount compounded with behavioural intenventions to solve phone use while driving.,Deaths and injuries due to phone use while driving,Yes,"Patient, Others (Drivers)",,"Public Health, Patient",,"Drivers are taking UBI program, a smartphone app or plug-in telematics device monitors how people drive to assess their risk and to price their insurance
 policy accordingly despite knowing its effect.","Adopting a sustained behaviour change from hand-held to hand-free phone use by using phone mount compounded with behavioural intenventions, such as habit-building reminders, gamification and social competition, and modest financial incentives.","Low motivation or awareness: don't know, understand or appreciate the values of desired behaviour",,"The social and instrumental rewards people get from using
 their phone are more immediate and certain, however, the pulishment is delayed and uncertain.","Multiple interventions can encourage a significant change in
 drivers’ phone use that lasted beyond the intervention
 period and impact on actual crash likelihood.",Stage 1,,Community Care,,,,,,,,,,,,,,,,,,,,,,
,Develop a consensus on effective implementation strategies to solve the insufficiency of understanding on stakeholder preferences for implementing evidence-based practices (EBPs).,Lack of understanding on stakeholder preferences for implementing evidence-based practices (EBPs) in behavioral health,Yes,"Administrative Staff, Physician, Public Health",,Everyone,,Stakeholders have varying preferences for EBP implementation strategies,Develop a consensus on effective implementation strategies that cater to the diverse preferences of stakeholders within the behavioral health system,Ambiguity: unclear guidance to users to adopt desired behaviour,,"Diverging priorities, responsibilities, and perspectives among different stakeholder groups",Addressing the variation in preferences may uncover new ways to enhance the quality of behavioral health care,"Stage 1, Stage 2, Stage 3, Stage 4",,"Primary Care, Community Care, All",,,,,,,,,,,,,,,,,,,,,,
,Utilize feedback interventions like peer comparison and audit feedback to solve the excession in opioid prescription. ,Excessive number of pills of opioid prescription poses a greater risk for future long-term opioid use.,Yes,"Physician, Nurse",,Patient,,Clinicians show variation in opioid prescribing patterns.,Utilize feedback interventions like peer comparison and audit feedback to inform clinicians of their prescribing patterns,Ambiguity: unclear guidance to users to adopt desired behaviour,,"The lack of standardized interventions, lack of awareness of patients' other opioid prescriptions.",Peer comparison feedback informs clinicians about their prescribing relative to peers to significantly reduce the number of pills per opioid prescription.,Stage 2,,Hospital Care,,,,,,,,,,,,,,,,,,,,,,
,Implement structural changes to solve health disaparity.,Health disparity,Yes,"Administrative Staff, Physician, Public Health",,Everyone,,Attempt to achieve equity through increased attention and funding but only see a low proportion of medical researchers who prioritise or intergrate efforts in equity.,"Implement structural changes to weave health equity principles into how it is designed, funded, carried out, disseminated, and implemented.",Ambiguity: unclear guidance to users to adopt desired behaviour,,"Historical neglect, systemic barriers, and lack of targeted training",Addressing equity prospectively and proactively in research from the beginning can drive more positive change compared to retroactively addressing inequities once they have been institutionalized.,"Stage 1, Stage 2, Stage 3, Stage 4",,All,,,,,,,,,,,,,,,,,,,,,,
,Prioritize scientifically backed approaches and develop and evaluate new structural approaches to solve gender inequities in academia.,"Address gender inequities in academia, worsened by COVID-19.",Yes,"Administrative Staff, Educator",,Everyone,,Women are underrepresented in senior roles and receive lower pay; COVID-19 exacerbated these issues,"Universities prioritize scientifically backed approaches to support women faculty, including individual-level approaches such as leadership training. They should also develop and evaluate new structural approaches, such as hiring strategies and policies.",Ambiguity: unclear guidance to users to adopt desired behaviour,,Systemic gender biases and a lack of targeted initiatives for structural approaches,Focused implementation science approaches can effectively reduce gender disparities in academia,"Stage 1, Stage 2, Stage 3, Stage 4",,Other: Reasearch Insititutions,,,,,,,,,,,,,,,,,,,,,,
,Apply MBC methods that are supported by evidence for effectiveness and clinical utility to solve ambiguity in leadership decision making on adoption of MBC approach.,Few guidelines are available to help organizational leadership determine what MBC approach to adopt,Yes,"Educator, Physician, Therapist",,Everyone,,"In response to the growing evidence and regulatory pressures, mental health organizations are increasingly seeking to adopt MBC as a part of standard care without a framework to refer.","Apply MBC methods that are supported by evidence for effectiveness and clinical utility, adapting to the unique needs of the setting",Ambiguity: unclear guidance to users to adopt desired behaviour,,"Varying MBC approaches, lack of comprehensive guidelines, and the need for specific evidence on effectiveness and utility","Effective MBC implementation can improve clinical decision-making, treatment outcomes, and overall care quality","Stage 1, Stage 2, Stage 3, Stage 4",,"Primary Care, Hospital Care, Home and Long-Term Care, Community Care",,,,,,,,,,,,,,,,,,,,,,
,Use a phone-based application to solve incompletion in data collection for client progress monitoring. ,"Many one-to-one aides (i.e., behavioral support staff) do not systemically collect quantitative data that are necessary for best-practice client progress monitoring",Yes,"Administrative Staff, Educator, Others (one-to-one aides and supervisors)",,Everyone,,"Existing methods are labor-intensive and lack timely feedback, affecting motivation for data collection","Use a phone-based application, developed with user-centered design and behavioral economics insights, for data collection","Low motivation or awareness: don't know, understand or appreciate the values of desired behaviour",,Lack of leadership buy-in and limited resources in community settings,"Facilitate better monitoring and support strategies by making data collection easier, more engaging, and efficient","Stage 1, Stage 2, Stage 3, Stage 4",,"Primary Care, Community Care",,,,,,,,,,,,,,,,,,,,,,
,"Adopt a novel scalable, patient-centered method of engaging patients after an ED visit for OUD to enhance naloxone acquisition, carrying, and use via text messaging","Improve naloxone uptake, carrying and use post-ED discharge",Yes,"Physician, Nurse",,Patient,,Disparity in engagement and follow-up on naloxone use post-discharge,"Adopt a novel scalable, patient-centered method of engaging patients after an ED visit for OUD to enhance naloxone acquisition, carrying, and use via text messaging",Ambiguity: unclear guidance to users to adopt desired behaviour,,"Lack of strategies that target habit formation, including repetition, context cues, and intermittent rewards","Text messaging can be used to quickly capture, analyze, understand the patient-reported outcomes data, and induce behavioural change in real time.",Stage 2,,Hospital Care,,,,,,,,,,,,,,,,,,,,,,
,Use wearable devices to monitor changes on patients in their daily health behaviors to solve the progression from prediabetes to diabetes among adults.,Underutilization of behavioral interventions and medications for preventing the progression from prediabetes to diabetes among adults,Yes,"Patient, Physician",,Patient,,"Most models predicting the progression from prediabetes to diabetes vary in accuracy, most focus on predicting outcomes over longer-term periods and rely on information available at a single timepoint.","Patients should be encouraged to use wearable devices to monitor changes in daily health behaviors, and physicians should utilize data from these devices to make informed decisions about interventions",Complexity: nuances or variations of implementing interventions in real life,,Hard to balance between the cost and accuracy of using wearable devices; using a wearable device to inform risk prediction is unknown and needs further study,"Real-time data from wearable devices into risk prediction models can improve the identification of individuals at high risk for worsening glycemic control, allowing for more targeted and effective interventions",Stage 1,,Primary Care,,,,,,,,,,,,,,,,,,,,,,
,Improve understanding of intention-implementation gap to solve underutilization of trauma narratives (TN) in trauma-focused cognitive-behavioral therapy (TF-CBT).,Underutilization of trauma narratives (TN) in trauma-focused cognitive-behavioral therapy (TF-CBT) by community therapists in treating children and adolescents,Yes,Other: Community Therapist,,Paitent,,Therapist is less motivated to deliver TNs compared to other cognitive behavioural therapy and express concerns about its appropriateness for some settings.,Adopt TNs more often after an improved understanding of intention-implementation gap.,Complexity: nuances or variations of implementing interventions in real life,,"Lack of confidence, concerns about exacerbating clients' symptoms, insufficient organizational support, cultural or familial norms regarding trauma discussion, and challenges related to chronic or ongoing trauma exposure among clients","With identified contextual factors and inner settings that may influence the development of intentions, an improved understanding of intention-implementation gap would help build up the strategy for TNs use enhancement.",Stage 3,,Community Care,,,,,,,,,,,,,,,,,,,,,,
,"Improve an understanding of facilitators, barriers, and strategies to solve the incomprehension on the adoption and integration of social determinants of health (SDOH).",Incomprehensive information for the adoption and integration of social determinants of health (SDOH) and social needs screening in clinical care.,Yes,Other: Researchers,,Patient,,Focus on developing screening tools withour exploring influential factors using established determinant frameworks.,"An understanding of facilitators, barriers, and strategies for the implementation of SDOH.","Low motivation or awareness: don't know, understand or appreciate the values of desired behaviour",,"Can be lack of awareness, training, and systemic support for SDOH integration","With a summary of this knowledge, future research could achieve intended treatment outcomes of SDOH and social needs screening, referral, and follow-up utilizing the comprehensive knowledge of known implementation factors.",Stage 2,,"Primary Care, Community Care",,,,,,,,,,,,,,,,,,,,,,
,Nudge patients with personalized and targeted text reminders to solve the low pharmacy vaccination uptake.,Low pharmacy vaccination uptake rates,Yes,"Administrative Staff, Physician",,Patient,,"Vaccination uptake rate doesn't meet the goal, and millions of patients who have taken the first dose forgot to take the second dose.",Patients should be nudged through personalized and targeted text reminders to increase vaccination rates,"Low motivation or awareness: don't know, understand or appreciate the values of desired behaviour",,"Forgetting, failing to plan, and low motivation","Personalized text reminders can close the intention-action gap, leading to higher vaccination rates",Stage 1,,Community Care,,,,,,,,,,,,,,,,,,,,,,
,Increase the use of evidence-based guidelines with identified facilitators and barriers  to solve the insufficient understanding in comprehensive polycystic ovary syndrome (PCOS) care.,Physicians lack understanding of how to diagnose and manage polycystic ovary syndrome (PCOS).,Yes,"Administrative Staff, Physician, Public Health",,Patient,,Physicans show low update of the screening recommendations despite international evidence-based guidelines was introduced in 2018.,Increase the use of evidence-based guidelines with identified facilitators and barriers in comprehensive PCOS care.,"Low motivation or awareness: don't know, understand or appreciate the values of desired behaviour",,"Lack of awareness, insufficient training, and resource constraints",Knowing the facilitators and barriers to care provided by general gynecologists and PCPs can inform the implementation of best practices for comprehensive PCOS care.,Stage 2,,"Primary Care, Hospital Care, Community Care",,,,,,,,,,,,,,,,,,,,,,
,Implement measures and incentives by payers and regulators to solve unmet parient-centered care (PCC) in inpatient psychiatry.,Unmet patient-centered care (PCC) in inpatient psychiatry.,Yes,"Administrative Staff, Physician",,Patient,,Lack of emphasis on PCC; current practices often feel more punitive than healing,Implement measures and incentives by payers and regulators to prioritize and evaluate PCC outcomes,Complexity: nuances or variations of implementing interventions in real life,,"Organizational priorities, influenced by payers and regulators, currently limit the ability to provide helpful care",Focusing on PCC could transform the care environment to be more healing and supportive for patients,Stage 3,,Hospital Care,,,,,,,,,,,,,,,,,,,,,,
,Prompt earlier conversation with patients using a better clinician assessment of life expectancy to solve underutilization of early conversation between clinician and patients with cancer.,Under-utilization of early conversations between clinicians and patients with cancer.,Yes,"Administrative Staff, Physician, Public Health",,Patient,,Physicians delay or miss conversations with patients about goals and care preferences.,Prompt earlier conversation with patients using a better clinician assessment of life expectancy faciitated by ML prognoistic algorithms.,Tech/tools constraints: the desired behaviour change is restricted due to underequipped or inaccessible technology/device/tools,,"Limited transparency and interpretability of the inputs, algorithm, and outputs; lack of knowledge in clinician perspectives on use of ML prognostic algorithms in practice.","Compared with conventional static algorithm prediction, ML prognostic algorithms collect data at multiple time points in a patient's trajectory, facilitate a more accurate prognosis.",Stage 2,,"Primary Care, Community Care",,,,,,,,,,,,,,,,,,,,,,
,"Regularly assess and initiate buprenorphine treatment for opioid use disorder, employ peer recovery specialists, and follow a multi-component strategy to solve opioid use disorder.",Little knowledge in methods of implementing emergency department-initiated buprenorphine for opioid use disorder.,Yes,"Physician, Nurse",,Patient,,Limited use of buprenorphine or take-home naloxone,"Emergency Department providers should regularly assess and initiate buprenorphine treatment for opioid use disorder, employ peer recovery specialists, and follow a multi-component strategy to enhance patient care",Complexity: nuances or variations of implementing interventions in real life,,"Time constraints, competing demands, lack of knowledge or comfort with opioid use disorder treatment, regulatory requirements, and absence of clear protocols or guidance","Sustained increases in treatment and process measures, enhancing opioid use disorder care in the emergency department",Stage 2,,Hospital Care,,,,,,,,,,,,,,,,,,,,,,
,Implementing a specialist-led model of care to solve the suboptimum in cardiovascular disease (CVD) prevention.,Suboptimal cardiovascular disease (CVD) prevention in patients with psoriatic disease,Yes,Physician,,Patient,,"Screening rates are suboptimal, and statins, while effective for CVD prevention, are underused in this patient group. Patients with psoriatic disease do not regularly see a primary care physician",Implementing a specialist-led model of care,"Low motivation or awareness: don't know, understand or appreciate the values of desired behaviour",,Current model may not effectively reach many patients with psoriatic disease,Improve direct access to CVD prevention care for psoriatic disease patients,Stage 2,,Primary Care,,,,,,,,,,,,,,,,,,,,,,
,leverage large multi-institutional collaborative research consortia to solve low update of implementation science (IS) in pediatric oncology.,Low uptake of implementation science (IS) in pediatric oncology,Yes,"Physician, Public Health",,"Patient, Nurse Practitioner, Physician, Nurse",,"Historical emphasis of pediatric oncology IS has been on cancer prevention, cancer control, and supportive care.","Achieve higher utilization of IS within supportive care, survivorship community, and sustainability by the influence of large multi-institutional collaborative research consortia.",Research lagging behind: researchers and/or healthcare practitioners need further understanding,,the unique facets of the cooperative group trial infrastructure for pediatric oncology,Widespread cooperative group trials with timely and effective central governance can narrow evidence-to-practice gap.,"Stage 1, Stage 2, Stage 3, Stage 4",,"Hospital Care, Other: Reasearch Insititutions",,,,,,,,,,,,,,,,,,,,,,
,Initiating ED treatment by incorporate a nurse-driven (opiord use disorder) OUD screening and treatment protocol to solve OUD and overdose.,Opioid use disorder (OUD) and overdose,Yes,"Nurse, Physician",,Patient,,"Patients with OUD are treated for other acute issues, medically cleared, discharged, and left to navigate a complex treatment system on their own.",Initiating ED treatment by incorporate a nurse-driven OUD screening and treatment protocol.,Complexity: nuances or variations of implementing interventions in real life,,ED clinicians feel uncomfortable to OUD management; competing priorities at ED,Intervene on OUD by identifying appropriate patients early in their ED stay,Stage 2,,Hospital Care,,,,,,,,,,,,,,,,,,,,,,
,Design interventions that seek to restructure and reinforce new practice and associate them with peer and reference group behaviours to solve the challenge in promoting professional behaviour change in healthcare.,Challenge in promoting professional behaviour change in healthcare.,Yes,"Physician, Nurse Practitioner",,Everyone,,"Some interventions are carried out to target individual behavioural processes instead of implemented through collection action. Some may fail just due to a less effective format, for instance, marketing.","Design interventions that seek to restructure and reinforce new practice and associate them with peer and reference group behaviours (eg, option leaders, educational meeting,educational outreach, reminders, etc)",Complexity: nuances or variations of implementing interventions in real life,,Success of behavioural interventions seem variable and the characteristics of more successful interventions are unclear.,By introducing interventions based on action and bundling them together would help bridge the gap between research evidence and clinical practice.,"Stage 2 and Stage 3, where decisions about patient treatment and management are made.",,"Primary Care, Hospital Care, Home and long-Term Care, Community Care",,,,,,,,,,,,,,,,,,,,,,
,Adopt consistent and scientifically backed practices to address COVID-19 spread through large-scale behavior change.,Address COVID-19 spread through large-scale behavior change.,Yes,Everyone,,Public Health,,"Adoption of required behaviours in population has been variable across countries, over time and across social groups.","Populations should adopt consistent and scientifically backed practices such as social distancing, mask-wearing, regular hand washing, and getting vaccinated when eligible.","Low motivation or awareness: don't know, understand or appreciate the values of desired behaviour",,"The public are lack of capability, motivation or opportunity, or their combination to drive behaviour change. Limited public trust in government and experts. Socio-economic constraints.","The public will be faciliated in taking expected behaviour change by effective and balanced interventions from authorities, combined with trust fostering.",Stage 1,,"Primary Care, Hospital Care, Home and Long-Term Care, Community Care, and more.",,,,,,,,,,,,,,,,,,,,,,
