,"Individuals should adopt and maintain healthier habits, facilitated by the use of Health Behavior Change Support Systems (HBCSS) to solve the challenge in metabolic syndrome prevention.",Promote lifestyle changes for metabolic syndrome prevention.,Yes,Patient,,Patient,,"Individuals take on common weight-loss strategies such as restricted number of calories, a reduced amount of fat, and an increased amount of exercise.","Individuals should adopt and maintain healthier habits, such as regular physical activity, balanced nutrition, and other lifestyle changes, facilitated by the use of Health Behavior Change Support Systems (HBCSS) like Onnikka designed to support habit formation and lifestyle intervention.",Complexity: nuances or variations of implementing interventions in real life,,"Lack of proper toolkits to help them self-monitor their health and intake, and raise awareness of unwanted habits.",Behavior change supported by HBCSS will address the problem by helping individuals develop and maintain healthy habits that lead to sustained lifestyle changes and reduce the risk of metabolic syndrome and improve overall health.,Stage 1,,"Primary Care, Home and Long-Term Care, Community Care.",,,,,,,,,,,,,,,,,,,,,,
,"Solve inefficiency and waste in healthcare by designing effective interventions to improve patient medication adherence and attendance and tak-up, including patient decision aids to improve care quality, adopting cost feedback to help reduce over treatment, enhancing discharge process, designing holistic interventions in improving individuals’ preventive health behaviours. ",Inefficiency and waste in healthcare.,Yes,"Physician, Nurse Practitioner, Patient, adminitrative Staff",,"Patient, Public Health",,"Overtreatment, non-adherence to medications, low attendance and take-up, mismatch between care received and patient preference, poor hand over, and poor individual's preventive health behaviours.","Healthcare providers should design effective interventions to improve patient medication adherence and attendance and tak-up, to include patient decision aids to improve care quality, to adopt cost feedback to help reduce over treatment, to enhance discharge process, and to design holistic interventions in improving individuals’ preventive health behaviours. Evidence-based practices should also be incrporated.","Low motivation or awareness: don't know, understand or appreciate the values of desired behaviour",,"Lack of awareness, motivation, or understanding of the importance of certain behaviors; habitual practices that are hard to change; and systemic issues in healthcare settings that do not support efficient behaviors.","This can be achieved through nudging interventions like simplified guidelines, reminders, default options, and social norm feedback.","Stage 1, Stage 2, Stage 3, Stage 4",,"Primary Care, Hospital, Community Care",,,,,,,,,,,,,,,,,,,,,,
,"Analyze the influencing factors of cognitive, social and environmental drivers and barriers around individuals to solve the challenge in achieving global health objectives.","Achieve global health objectives: reduce diseases, improve antibiotic stewardship, boost prevention, and enhance epidemic management.",Yes,"Public health experts (practioners, policy-makers, researchers)",,Everyone,,"Public health efforts have often focused on increasing knowledge and awareness, but have not fully addressed the behavioral influences within individuals' environments.","Public health efforts should be analyzing the influencing factors of cognitive, social and environmental drivers and barriers around individuals. This would allow for the implementation of discrete changes in the environment through designing and improving the impact of programmes and policies which would in turn impact behaviours",Research lagging behind: researchers and/or healthcare practitioners need further understanding,,"The desired behaviour is not exemplified due to the practitioners and researchers not being able to capture, describe or understand the mechanisms of actions of effective behavioural science techniques. In order to address the challenges and behaviours more research, investment, capacity-building, experimentation and improved collaboration between public health experts and behavioural scientists is required.","By systematically employing behavioral science, public health programs can be designed to impact behavior effectively.","Stage 1, Stage 2, Stage 3, Stage 4",,"Primary Care, Hospital Care, Home and Long-Term Care, Community Care, and more.",,,,,,,,,,,,,,,,,,,,,,
,Recommend patients to seek supplemental screening to solve low uptake of suplemental breast MRI screening in women with exremely dense breasts.,Low uptake of supplemental breast MRI screening in women with extremely dense breasts.,Yes,"Physician, Patient",,Patient,,"Few women undergo supplemental breast MRI exams, with screening consistently lower among racially minoritized populations.",Patients should seek supplemental screening and clinicians should recommend it.,"Low motivation or awareness: don't know, understand or appreciate the values of desired behaviour",,"Lack of awareness, financial concerns, and the complexity of accessing MRI screenings, social-economics constraints, absence of consistent guidelines","By implementing - 
 nudge on patients: educational and actionable (call to action) text message
 Nudge on clinicians: A note embedded within mammogram result reports served as timely notice to focus clinicians' attention,
 ordering and scheulding supplemental breast MRI increase.","Stage 1, Stage 2",,Primary Care,,,,,,,,,,,,,,,,,,,,,,
,Adopt a tailored approach to opioid prescribing and consider patient-level characteristics to solve the mismatch in surgical pain management and opioid stewardship.,Balancing surgical pain management and opioid stewardship.,Yes,"Physician, Nurse Practitioner",,Patient,,there is a mismatch between the number of opioid tablets prescribed and the actual consumption by patients that leads to unused opioids.,Clinicians should adopt a tailored approach to opioid prescribing and consider patient-level characteristics to better match prescription size with actual needs.,Systemic corporation: the desired behaviour involves some changes to upstream/downstream practice in the first place,,"1) most guidelines recommend a single default number of tablets meant to cover a majority of patients' needs.
 2) Lack of data to determine wich patient characteristics or variables can be used to support a more tailored approach","Can lead to a reduction in unused opioids, potentially decreasing the risk of opioid misuse within the community and improving postoperative pain management.",Stage 3,,"Primary Care, Hospital Care",,,,,,,,,,,,,,,,,,,,,,
,A high understanding of symptoms and functional status of their patients to solve insufficiency in communication about symptom and function between advanced cancer patients and oncologists.,Insufficient symptom and function communication between advanced cancer patients and oncologists.,Yes,"Physician, Nurse Practitioner, Nurse, Pharmacist, Patient",,"Patient, Nurse Practitioner, Physician",,Oncology clinicians identify as low as 25% of patient-reported symptoms. Clinicians underestimate symptom severity. Oncology clinicians often overestimate patient activity levels.,Clinicians have a high understanding of symptoms and functional status of their patients.,Tech/tools constraints: the desired behaviour change is restricted due to underequipped or inaccessible technology/device/tools,,Lack in method in intergrating clinical and prognostic data in clinical care to prompt earlier recognition of symptom and functional decline.,"Behavioral economic principles can inform the optimal use of data to improve symptom management, for instance, automated defaut email or text, active choice.","Stage 3, Stage 4",,"Primary Care, Hospital Care",,,,,,,,,,,,,,,,,,,,,,
,"Active recommendation of tobacco use treatment (TUT) and discussion about taobacco use and treatment options to solve low utilization of evidence-based TUT.
",Low utilization of evidence-based tobacco treatment used for smoking cancer patients in cancer centers.,Yes,"Physician, Patient",,Patient,,"There's a significant gap in systematically engaging patients in tobacco use treatment (TUT), with many cancer centers failing to consistently identify patient tobacco use and engage in evidence-based TUT.","Clinicians should actively engage in TUT by recommending it to their patients, and patients should be more open and proactive in discussing their tobacco use and treatment options with their clinicians.","Low motivation or awareness: don't know, understand or appreciate the values of desired behaviour",,"Clinician's pessimism about TUT effectiveness, misconceptions about patient resistance, implicit biases, and certain patient challenges such as low self-efficacy and perceived benefits of quitting, perceived treatment risk and socio-economic constraints.","Behavioral economic informed EHR nudges, more specifically, opting out of the deflaut option, aimed at oncology clinicians significantly increase TUT engagement.","Stage 2, Stage 3",,Hospital Care,,,,,,,,,,,,,,,,,,,,,,
,Effectively use patients' health status  for patient management to solve hospital admission challenge at COVID time.,Manage COVID-19 patients at home to monitor symptoms and reduce hospital admissions.,Yes,Patient,,Patient,,Patients and clinicians may not fully utilize or engage with remote monitoring programs due to various barriers.,Patients should regularly update their health status through the program and clinicians should effectively use this data for patient management.,Ambiguity: unclear guidance to users to adopt desired behaviour,,"Lack of clarity about enrollment, preferences for communication methods, and accessibility issues for some patient groups.","The program could lead to improved patient management, earlier intervention, and potentially reduced hospital visits.","Stage 1, Stage 2",,"Primary Care, Home and Long-Term Care, Community Care.",,,,,,,,,,,,,,,,,,,,,,
,Use universal screening protocol and automated prompts for treatment initiation to solve inconsistency in adoption of ED-initiated buprenorphine for opioid use disorder.,Inconsistent adoption of ED-initiated buprenorphine for opioid use disorder.,Yes,"Physician, Pharmacist",,Patient,,Variability in the adoption of buprenorphine treatment.,Clinicians should use a universal screening protocol and automated prompts for treatment initiation.,Systemic corporation: the desired behaviour involves some changes to upstream/downstream practice in the first place,,"The barriers to screening and treatment include limited clinician knowledge and experience, lack of streamlined workflows, competing demands, limited postdischarge care coordination resources, and continued stigma.",Leads to more consistent and effective treatment of opioid use disorder in EDs.,"Stage 2, Stage 3",,Hospital Care,,,,,,,,,,,,,,,,,,,,,,
,"Take extra consideration of multidimensional factors (social, functional, and cognitive) on patients to solve imcomprehensive evaluation and excess variation in hospitalization rates.",Incomprehensive evaluation in hospital admissions for older patients with medium illness leading to excess variation in hospitalization rates across hospitals and across physicians.,Yes,Physician,,Patient,,Admissions are often based primarily on immediate medical conditions without considering broader patient needs.,"Patients , especially elder patienrs, at middle level of illness need clinic to take extra consideration of multidimensional factors (social, functional, and cognitive) in making hospital admission decisions. For instance, using clincal risk scores to guide decision-making.",Systemic corporation: the desired behaviour involves some changes to upstream/downstream practice in the first place,,Lack of systematic methods to capture the data of holistic factors in clinical decision-making and the default to hospitalization.,"By introducing an improved measurement to admission decision making, hospitals/clinics can reduce low-value admission and ensure the caring for those who are in great medical needs.",Stage 2,,Hospital Care,,,,,,,,,,,,,,,,,,,,,,
,Initiate evidence-based treatments for OUD during hospitalization to solve the increasing before-medically-advised (BMA) discharges for patients with opioid use disorder.,"Increasing before-medically-advised discharges for patients with opioid use disorder, particularly those with injection-related infections.",Yes,"Physician, Pharmacist",,Patient,,Patients are often discharged BMA due to untreated withdrawal and pain.,"Hospitals should initiate evidence-based treatments for OUD, such as methadone and buprenorphine, during hospitalization.","Low motivation or awareness: don't know, understand or appreciate the values of desired behaviour",,Lack of protocol for OUD treatment initiation in hospitals and reluctance due to potential complications.,"Additionally, the behaviour change can reduce the all-cause death and hospital readmission.","Stage 3, Stage 4",,Hospital Care,,,,,,,,,,,,,,,,,,,,,,